{
  "$schema": "urn:mcgen:schema:catalog:1",
  "blockers": [],
  "catalogId": "catalog.9dacda0438726d9cc8ae048a",
  "category": "mod",
  "components": [
    {
      "channel": "release",
      "compatibility": "declared",
      "component": "mappings-intermediary",
      "coordinate": "net.fabricmc:intermediary:1.15-pre2",
      "id": "component.fabric.a7d7f0c80a717e4b6ca16d56",
      "sourceEntries": [
        {
          "entryIndex": 266,
          "snapshotId": "fabric.d5f0718a2c465a479a633101",
          "sourceIndexes": [
            3
          ]
        }
      ],
      "status": "discovered",
      "version": "1.15-pre2"
    },
    {
      "channel": "release-candidate",
      "compatibility": "declared",
      "component": "mappings-yarn",
      "coordinate": "net.fabricmc:yarn:1.15-pre2+build.1",
      "id": "component.fabric.ac9a0890d5f49a106084031c",
      "sourceEntries": [
        {
          "entryIndex": 267,
          "snapshotId": "fabric.d5f0718a2c465a479a633101",
          "sourceIndexes": [
            2
          ]
        }
      ],
      "status": "discovered",
      "version": "1.15-pre2+build.1"
    },
    {
      "channel": "release-candidate",
      "compatibility": "declared",
      "component": "mappings-yarn",
      "coordinate": "net.fabricmc:yarn:1.15-pre2+build.2",
      "id": "component.fabric.7fcd0cdf042b4e62f314ac5e",
      "sourceEntries": [
        {
          "entryIndex": 268,
          "snapshotId": "fabric.d5f0718a2c465a479a633101",
          "sourceIndexes": [
            2
          ]
        }
      ],
      "status": "discovered",
      "version": "1.15-pre2+build.2"
    },
    {
      "channel": "release-candidate",
      "compatibility": "declared",
      "component": "mappings-yarn",
      "coordinate": "net.fabricmc:yarn:1.15-pre2+build.3",
      "id": "component.fabric.4f09b589f21a06710701f342",
      "sourceEntries": [
        {
          "entryIndex": 269,
          "snapshotId": "fabric.d5f0718a2c465a479a633101",
          "sourceIndexes": [
            2
          ]
        }
      ],
      "status": "discovered",
      "version": "1.15-pre2+build.3"
    },
    {
      "channel": "release-candidate",
      "compatibility": "declared",
      "component": "mappings-yarn",
      "coordinate": "net.fabricmc:yarn:1.15-pre2+build.4",
      "id": "component.fabric.3cb7b4533e6269c45ab73cca",
      "sourceEntries": [
        {
          "entryIndex": 270,
          "snapshotId": "fabric.d5f0718a2c465a479a633101",
          "sourceIndexes": [
            2
          ]
        }
      ],
      "status": "discovered",
      "version": "1.15-pre2+build.4"
    },
    {
      "channel": "release-candidate",
      "compatibility": "declared",
      "component": "minecraft",
      "coordinate": "com.mojang:minecraft:1.15-pre2",
      "id": "component.fabric.fd05636cbdb2af3040d365fa",
      "sourceEntries": [
        {
          "entryIndex": 271,
          "snapshotId": "fabric.d5f0718a2c465a479a633101",
          "sourceIndexes": [
            0
          ]
        }
      ],
      "status": "discovered",
      "version": "1.15-pre2"
    }
  ],
  "edges": [
    {
      "confidence": "published",
      "from": "target.fabric.62bd6fdaa7c4317f7f3dcb96",
      "kind": "targets",
      "sourceEntries": [
        {
          "entryIndex": 270,
          "snapshotId": "fabric.d5f0718a2c465a479a633101",
          "sourceIndexes": [
            2
          ]
        }
      ],
      "to": "component.fabric.3cb7b4533e6269c45ab73cca"
    },
    {
      "confidence": "published",
      "from": "target.fabric.62bd6fdaa7c4317f7f3dcb96",
      "kind": "targets",
      "sourceEntries": [
        {
          "entryIndex": 269,
          "snapshotId": "fabric.d5f0718a2c465a479a633101",
          "sourceIndexes": [
            2
          ]
        }
      ],
      "to": "component.fabric.4f09b589f21a06710701f342"
    },
    {
      "confidence": "published",
      "from": "target.fabric.62bd6fdaa7c4317f7f3dcb96",
      "kind": "targets",
      "sourceEntries": [
        {
          "entryIndex": 268,
          "snapshotId": "fabric.d5f0718a2c465a479a633101",
          "sourceIndexes": [
            2
          ]
        }
      ],
      "to": "component.fabric.7fcd0cdf042b4e62f314ac5e"
    },
    {
      "confidence": "published",
      "from": "target.fabric.62bd6fdaa7c4317f7f3dcb96",
      "kind": "targets",
      "sourceEntries": [
        {
          "entryIndex": 266,
          "snapshotId": "fabric.d5f0718a2c465a479a633101",
          "sourceIndexes": [
            3
          ]
        }
      ],
      "to": "component.fabric.a7d7f0c80a717e4b6ca16d56"
    },
    {
      "confidence": "published",
      "from": "target.fabric.62bd6fdaa7c4317f7f3dcb96",
      "kind": "targets",
      "sourceEntries": [
        {
          "entryIndex": 267,
          "snapshotId": "fabric.d5f0718a2c465a479a633101",
          "sourceIndexes": [
            2
          ]
        }
      ],
      "to": "component.fabric.ac9a0890d5f49a106084031c"
    },
    {
      "confidence": "published",
      "from": "target.fabric.62bd6fdaa7c4317f7f3dcb96",
      "kind": "targets",
      "sourceEntries": [
        {
          "entryIndex": 271,
          "snapshotId": "fabric.d5f0718a2c465a479a633101",
          "sourceIndexes": [
            0
          ]
        }
      ],
      "to": "component.fabric.fd05636cbdb2af3040d365fa"
    }
  ],
  "id": "catalog.fabric.fbb902b029b64129369f1958",
  "key": "1.15-pre2",
  "keyKind": "minecraft",
  "platform": "fabric",
  "schemaVersion": 1,
  "sourceSnapshots": [
    "fabric.d5f0718a2c465a479a633101"
  ]
}
