{
  "$schema": "urn:mcgen:schema:catalog:1",
  "blockers": [],
  "catalogId": "catalog.9dacda0438726d9cc8ae048a",
  "category": "toolchain",
  "components": [
    {
      "channel": "release",
      "compatibility": "declared",
      "component": "minecraft-runtime",
      "coordinate": "com.mojang:java-runtime-gamma:java-17",
      "id": "component.java.172f49b2c53677d820066753",
      "sourceEntries": [
        {
          "entryIndex": 146,
          "snapshotId": "java.bcc3a227324932f44e420ef9",
          "sourceIndexes": [
            152
          ]
        }
      ],
      "status": "discovered",
      "version": "17"
    }
  ],
  "edges": [
    {
      "confidence": "published",
      "from": "target.java.7cb25791a01721c99a56922b",
      "kind": "targets",
      "sourceEntries": [
        {
          "entryIndex": 146,
          "snapshotId": "java.bcc3a227324932f44e420ef9",
          "sourceIndexes": [
            152
          ]
        }
      ],
      "to": "component.java.172f49b2c53677d820066753"
    }
  ],
  "id": "catalog.java.db6f966516b43b459689dea3",
  "key": "1.19-pre3",
  "keyKind": "minecraft",
  "platform": "java",
  "schemaVersion": 1,
  "sourceSnapshots": [
    "java.bcc3a227324932f44e420ef9"
  ]
}
