{
  "$schema": "urn:mcgen:schema:catalog:1",
  "blockers": [],
  "catalogId": "catalog.008de6ad1b5a39d3d1751d8e",
  "category": "toolchain",
  "components": [
    {
      "channel": "release",
      "compatibility": "declared",
      "component": "minecraft-runtime",
      "coordinate": "com.mojang:jre-legacy:java-8",
      "id": "component.java.2fe0a3ee2f75f27069b24b22",
      "sourceEntries": [
        {
          "entryIndex": 540,
          "snapshotId": "java.bcc3a227324932f44e420ef9",
          "sourceIndexes": [
            564
          ]
        }
      ],
      "status": "discovered",
      "version": "8"
    }
  ],
  "edges": [
    {
      "confidence": "published",
      "from": "target.java.448eaed872b6dea25f26c5d9",
      "kind": "targets",
      "sourceEntries": [
        {
          "entryIndex": 540,
          "snapshotId": "java.bcc3a227324932f44e420ef9",
          "sourceIndexes": [
            564
          ]
        }
      ],
      "to": "component.java.2fe0a3ee2f75f27069b24b22"
    }
  ],
  "id": "catalog.java.71227410246776f22c006a27",
  "key": "18w08b",
  "keyKind": "minecraft",
  "platform": "java",
  "schemaVersion": 1,
  "sourceSnapshots": [
    "java.bcc3a227324932f44e420ef9"
  ]
}
