{
  "$schema": "urn:mcgen:schema:catalog:1",
  "blockers": [],
  "catalogId": "catalog.8345191360931e453e072d3b",
  "category": "toolchain",
  "components": [
    {
      "channel": "release",
      "compatibility": "declared",
      "component": "minecraft-runtime",
      "coordinate": "com.mojang:java-runtime-delta:java-21",
      "id": "component.java.0bd7df5aef1151afb6a3fcc1",
      "sourceEntries": [
        {
          "entryIndex": 219,
          "snapshotId": "java.bcc3a227324932f44e420ef9",
          "sourceIndexes": [
            225
          ]
        }
      ],
      "status": "discovered",
      "version": "21"
    }
  ],
  "edges": [
    {
      "confidence": "published",
      "from": "target.java.8665d1b803b1e3b8d7ee6962",
      "kind": "targets",
      "sourceEntries": [
        {
          "entryIndex": 219,
          "snapshotId": "java.bcc3a227324932f44e420ef9",
          "sourceIndexes": [
            225
          ]
        }
      ],
      "to": "component.java.0bd7df5aef1151afb6a3fcc1"
    }
  ],
  "id": "catalog.java.99353646dc3be31002867f0d",
  "key": "1.20.6-rc1",
  "keyKind": "minecraft",
  "platform": "java",
  "schemaVersion": 1,
  "sourceSnapshots": [
    "java.bcc3a227324932f44e420ef9"
  ]
}
