{
  "$schema": "urn:mcgen:schema:catalog:1",
  "blockers": [],
  "catalogId": "catalog.008de6ad1b5a39d3d1751d8e",
  "category": "toolchain",
  "components": [
    {
      "channel": "snapshot",
      "compatibility": "declared",
      "component": "game-version",
      "coordinate": "com.mojang:minecraft:15w51a",
      "id": "component.minecraft.fc90052e627e625385bf853d",
      "sourceEntries": [
        {
          "entryIndex": 494,
          "snapshotId": "mojang.378f919a766c4184b3ce9210",
          "sourceIndexes": [
            0
          ]
        }
      ],
      "status": "discovered",
      "version": "15w51a"
    }
  ],
  "edges": [
    {
      "confidence": "published",
      "from": "target.minecraft.e272affe35141f82a26dd5f4",
      "kind": "targets",
      "sourceEntries": [
        {
          "entryIndex": 494,
          "snapshotId": "mojang.378f919a766c4184b3ce9210",
          "sourceIndexes": [
            0
          ]
        }
      ],
      "to": "component.minecraft.fc90052e627e625385bf853d"
    }
  ],
  "id": "catalog.minecraft.128c363dd58caf035f4aea16",
  "key": "15w51a",
  "keyKind": "minecraft",
  "platform": "minecraft",
  "schemaVersion": 1,
  "sourceSnapshots": [
    "mojang.378f919a766c4184b3ce9210"
  ]
}
