{
  "$schema": "urn:mcgen:schema:catalog:1",
  "blockers": [],
  "catalogId": "catalog.a457a11608c32bf9a81bda4b",
  "category": "toolchain",
  "components": [
    {
      "channel": "snapshot",
      "compatibility": "declared",
      "component": "game-version",
      "coordinate": "com.mojang:minecraft:1.13-pre4",
      "id": "component.minecraft.ce6d9350bc2fab277a528751",
      "sourceEntries": [
        {
          "entryIndex": 29,
          "snapshotId": "mojang.378f919a766c4184b3ce9210",
          "sourceIndexes": [
            0
          ]
        }
      ],
      "status": "discovered",
      "version": "1.13-pre4"
    }
  ],
  "edges": [
    {
      "confidence": "published",
      "from": "target.minecraft.3f70161bf9585db78c1b35f7",
      "kind": "targets",
      "sourceEntries": [
        {
          "entryIndex": 29,
          "snapshotId": "mojang.378f919a766c4184b3ce9210",
          "sourceIndexes": [
            0
          ]
        }
      ],
      "to": "component.minecraft.ce6d9350bc2fab277a528751"
    }
  ],
  "id": "catalog.minecraft.21a63a4630ee70cca69336b9",
  "key": "1.13-pre4",
  "keyKind": "minecraft",
  "platform": "minecraft",
  "schemaVersion": 1,
  "sourceSnapshots": [
    "mojang.378f919a766c4184b3ce9210"
  ]
}
