{
  "$schema": "urn:mcgen:schema:catalog:1",
  "blockers": [],
  "catalogId": "catalog.9dacda0438726d9cc8ae048a",
  "category": "toolchain",
  "components": [
    {
      "channel": "release",
      "compatibility": "declared",
      "component": "minecraft-runtime",
      "coordinate": "com.mojang:jre-legacy:java-8",
      "id": "component.java.4b606b25df0d2a3914f46a15",
      "sourceEntries": [
        {
          "entryIndex": 281,
          "snapshotId": "java.bcc3a227324932f44e420ef9",
          "sourceIndexes": [
            287
          ]
        }
      ],
      "status": "discovered",
      "version": "8"
    }
  ],
  "edges": [
    {
      "confidence": "published",
      "from": "target.java.a27cd2cfeca3fe1a0c3b17ae",
      "kind": "targets",
      "sourceEntries": [
        {
          "entryIndex": 281,
          "snapshotId": "java.bcc3a227324932f44e420ef9",
          "sourceIndexes": [
            287
          ]
        }
      ],
      "to": "component.java.4b606b25df0d2a3914f46a15"
    }
  ],
  "id": "catalog.java.98aafd47aa38ce38a89839b2",
  "key": "1.4",
  "keyKind": "minecraft",
  "platform": "java",
  "schemaVersion": 1,
  "sourceSnapshots": [
    "java.bcc3a227324932f44e420ef9"
  ]
}
