{
  "$schema": "urn:mcgen:schema:catalog:1",
  "blockers": [],
  "catalogId": "catalog.8345191360931e453e072d3b",
  "category": "toolchain",
  "components": [
    {
      "channel": "release",
      "compatibility": "declared",
      "component": "minecraft-runtime",
      "coordinate": "com.mojang:java-runtime-delta:java-21",
      "id": "component.java.a268bd0361a1591991a9789b",
      "sourceEntries": [
        {
          "entryIndex": 741,
          "snapshotId": "java.bcc3a227324932f44e420ef9",
          "sourceIndexes": [
            765
          ]
        }
      ],
      "status": "discovered",
      "version": "21"
    }
  ],
  "edges": [
    {
      "confidence": "published",
      "from": "target.java.5fe9136488b285b7c6f6a088",
      "kind": "targets",
      "sourceEntries": [
        {
          "entryIndex": 741,
          "snapshotId": "java.bcc3a227324932f44e420ef9",
          "sourceIndexes": [
            765
          ]
        }
      ],
      "to": "component.java.a268bd0361a1591991a9789b"
    }
  ],
  "id": "catalog.java.5a00325545bd496acf43c604",
  "key": "24w40a",
  "keyKind": "minecraft",
  "platform": "java",
  "schemaVersion": 1,
  "sourceSnapshots": [
    "java.bcc3a227324932f44e420ef9"
  ]
}
