{
  "$schema": "urn:mcgen:schema:catalog:1",
  "blockers": [],
  "catalogId": "catalog.a457a11608c32bf9a81bda4b",
  "category": "toolchain",
  "components": [
    {
      "channel": "release",
      "compatibility": "declared",
      "component": "minecraft-runtime",
      "coordinate": "com.mojang:jre-legacy:java-8",
      "id": "component.java.2e6b53a380f69b016de82f11",
      "sourceEntries": [
        {
          "entryIndex": 341,
          "snapshotId": "java.bcc3a227324932f44e420ef9",
          "sourceIndexes": [
            352
          ]
        }
      ],
      "status": "discovered",
      "version": "8"
    }
  ],
  "edges": [
    {
      "confidence": "published",
      "from": "target.java.03b75fad4472420a8b358a95",
      "kind": "targets",
      "sourceEntries": [
        {
          "entryIndex": 341,
          "snapshotId": "java.bcc3a227324932f44e420ef9",
          "sourceIndexes": [
            352
          ]
        }
      ],
      "to": "component.java.2e6b53a380f69b016de82f11"
    }
  ],
  "id": "catalog.java.d33f9010a16397a9c0b8cfaa",
  "key": "1.9.1-pre2",
  "keyKind": "minecraft",
  "platform": "java",
  "schemaVersion": 1,
  "sourceSnapshots": [
    "java.bcc3a227324932f44e420ef9"
  ]
}
