{
  "$schema": "urn:mcgen:schema:catalog:1",
  "blockers": [],
  "catalogId": "catalog.8345191360931e453e072d3b",
  "category": "toolchain",
  "components": [
    {
      "channel": "release",
      "compatibility": "declared",
      "component": "minecraft-runtime",
      "coordinate": "com.mojang:jre-legacy:java-8",
      "id": "component.java.3cb7b8961bf7e314fda76e89",
      "sourceEntries": [
        {
          "entryIndex": 858,
          "snapshotId": "java.bcc3a227324932f44e420ef9",
          "sourceIndexes": [
            882
          ]
        }
      ],
      "status": "discovered",
      "version": "8"
    }
  ],
  "edges": [
    {
      "confidence": "published",
      "from": "target.java.b2e1eaa67de71a7277f583f7",
      "kind": "targets",
      "sourceEntries": [
        {
          "entryIndex": 858,
          "snapshotId": "java.bcc3a227324932f44e420ef9",
          "sourceIndexes": [
            882
          ]
        }
      ],
      "to": "component.java.3cb7b8961bf7e314fda76e89"
    }
  ],
  "id": "catalog.java.b9903ddfbc4fb3d91981c7fb",
  "key": "b1.2_02",
  "keyKind": "minecraft",
  "platform": "java",
  "schemaVersion": 1,
  "sourceSnapshots": [
    "java.bcc3a227324932f44e420ef9"
  ]
}
