{
  "$schema": "urn:mcgen:schema:catalog:1",
  "blockers": [],
  "catalogId": "catalog.a457a11608c32bf9a81bda4b",
  "category": "toolchain",
  "components": [
    {
      "channel": "snapshot",
      "compatibility": "declared",
      "component": "game-version",
      "coordinate": "com.mojang:minecraft:14w28b",
      "id": "component.minecraft.04571a8fc4dba77d1e3e73cd",
      "sourceEntries": [
        {
          "entryIndex": 429,
          "snapshotId": "mojang.378f919a766c4184b3ce9210",
          "sourceIndexes": [
            0
          ]
        }
      ],
      "status": "discovered",
      "version": "14w28b"
    }
  ],
  "edges": [
    {
      "confidence": "published",
      "from": "target.minecraft.f84794bd017b8d7b073a22dc",
      "kind": "targets",
      "sourceEntries": [
        {
          "entryIndex": 429,
          "snapshotId": "mojang.378f919a766c4184b3ce9210",
          "sourceIndexes": [
            0
          ]
        }
      ],
      "to": "component.minecraft.04571a8fc4dba77d1e3e73cd"
    }
  ],
  "id": "catalog.minecraft.5e29eada74a215ee54ee9de0",
  "key": "14w28b",
  "keyKind": "minecraft",
  "platform": "minecraft",
  "schemaVersion": 1,
  "sourceSnapshots": [
    "mojang.378f919a766c4184b3ce9210"
  ]
}
