{
  "$schema": "urn:mcgen:schema:catalog:1",
  "blockers": [],
  "catalogId": "catalog.2f6abac0f1061095b2999e9c",
  "category": "toolchain",
  "components": [
    {
      "channel": "release",
      "compatibility": "declared",
      "component": "minecraft-runtime",
      "coordinate": "com.mojang:java-runtime-delta:java-21",
      "id": "component.java.a10cadf4059fa578aaed2328",
      "sourceEntries": [
        {
          "entryIndex": 235,
          "snapshotId": "java.bcc3a227324932f44e420ef9",
          "sourceIndexes": [
            241
          ]
        }
      ],
      "status": "discovered",
      "version": "21"
    }
  ],
  "edges": [
    {
      "confidence": "published",
      "from": "target.java.a274f0e010db75fb9b9e4636",
      "kind": "targets",
      "sourceEntries": [
        {
          "entryIndex": 235,
          "snapshotId": "java.bcc3a227324932f44e420ef9",
          "sourceIndexes": [
            241
          ]
        }
      ],
      "to": "component.java.a10cadf4059fa578aaed2328"
    }
  ],
  "id": "catalog.java.b6bc04d8fb4edfce6bb7c869",
  "key": "1.21.11-pre5",
  "keyKind": "minecraft",
  "platform": "java",
  "schemaVersion": 1,
  "sourceSnapshots": [
    "java.bcc3a227324932f44e420ef9"
  ]
}
