{
  "$schema": "urn:mcgen:schema:catalog:1",
  "blockers": [],
  "catalogId": "catalog.2f6abac0f1061095b2999e9c",
  "category": "toolchain",
  "components": [
    {
      "channel": "release",
      "compatibility": "declared",
      "component": "game-version",
      "coordinate": "com.mojang:minecraft:1.14.2",
      "id": "component.minecraft.58ed35dd1f39f85baee2770d",
      "sourceEntries": [
        {
          "entryIndex": 50,
          "snapshotId": "mojang.378f919a766c4184b3ce9210",
          "sourceIndexes": [
            0
          ]
        }
      ],
      "status": "discovered",
      "version": "1.14.2"
    }
  ],
  "edges": [
    {
      "confidence": "published",
      "from": "target.minecraft.4d9ba959b09d92d3f6fb432c",
      "kind": "targets",
      "sourceEntries": [
        {
          "entryIndex": 50,
          "snapshotId": "mojang.378f919a766c4184b3ce9210",
          "sourceIndexes": [
            0
          ]
        }
      ],
      "to": "component.minecraft.58ed35dd1f39f85baee2770d"
    }
  ],
  "id": "catalog.minecraft.608e0ffb95a8ee909beb7343",
  "key": "1.14.2",
  "keyKind": "minecraft",
  "platform": "minecraft",
  "schemaVersion": 1,
  "sourceSnapshots": [
    "mojang.378f919a766c4184b3ce9210"
  ]
}
