{
  "$schema": "urn:mcgen:schema:catalog:1",
  "blockers": [],
  "catalogId": "catalog.8c773be4f246b07e7bf6fa49",
  "category": "plugin",
  "components": [
    {
      "channel": "snapshot",
      "component": "bukkit-api",
      "coordinate": "org.bukkit:bukkit:1.10-R0.1-SNAPSHOT",
      "id": "component.bukkit.549b05c18865152bce087189",
      "sourceEntries": [
        {
          "entryIndex": 0,
          "snapshotId": "bukkit.d6706b848d7d7899f7a09e7c",
          "sourceIndexes": [
            0
          ]
        }
      ],
      "status": "discovered",
      "version": "1.10-R0.1-SNAPSHOT"
    }
  ],
  "edges": [
    {
      "confidence": "published",
      "from": "target.bukkit.040d3d177a4f0d072f09ebc5",
      "kind": "targets",
      "sourceEntries": [
        {
          "entryIndex": 0,
          "snapshotId": "bukkit.d6706b848d7d7899f7a09e7c",
          "sourceIndexes": [
            0
          ]
        }
      ],
      "to": "component.bukkit.549b05c18865152bce087189"
    }
  ],
  "id": "catalog.bukkit.541fd93f3c454a13e40dadad",
  "key": "1.10",
  "keyKind": "minecraft",
  "platform": "bukkit",
  "schemaVersion": 1,
  "sourceSnapshots": [
    "bukkit.d6706b848d7d7899f7a09e7c"
  ]
}
