{
  "$schema": "urn:mcgen:schema:catalog:1",
  "blockers": [],
  "catalogId": "catalog.9dacda0438726d9cc8ae048a",
  "category": "toolchain",
  "components": [
    {
      "channel": "release",
      "compatibility": "declared",
      "component": "minecraft-runtime",
      "coordinate": "com.mojang:java-runtime-alpha:java-16",
      "id": "component.java.663d187a98a82f06a2cce9c1",
      "sourceEntries": [
        {
          "entryIndex": 112,
          "snapshotId": "java.bcc3a227324932f44e420ef9",
          "sourceIndexes": [
            118
          ]
        }
      ],
      "status": "discovered",
      "version": "16"
    }
  ],
  "edges": [
    {
      "confidence": "published",
      "from": "target.java.953ac2dd447ad2f173e5cdf3",
      "kind": "targets",
      "sourceEntries": [
        {
          "entryIndex": 112,
          "snapshotId": "java.bcc3a227324932f44e420ef9",
          "sourceIndexes": [
            118
          ]
        }
      ],
      "to": "component.java.663d187a98a82f06a2cce9c1"
    }
  ],
  "id": "catalog.java.08cce96c4efa4b7675a7f3b0",
  "key": "1.17-rc1",
  "keyKind": "minecraft",
  "platform": "java",
  "schemaVersion": 1,
  "sourceSnapshots": [
    "java.bcc3a227324932f44e420ef9"
  ]
}
