{
  "$schema": "urn:mcgen:schema:catalog:1",
  "blockers": [],
  "catalogId": "catalog.8c773be4f246b07e7bf6fa49",
  "category": "toolchain",
  "components": [
    {
      "channel": "snapshot",
      "component": "game-version",
      "coordinate": "com.mojang:minecraft:18w14a",
      "id": "component.minecraft.61a6f31a37701a23088dccfc",
      "sourceEntries": [
        {
          "entryIndex": 565,
          "snapshotId": "mojang.378f919a766c4184b3ce9210",
          "sourceIndexes": [
            0
          ]
        }
      ],
      "status": "discovered",
      "version": "18w14a"
    }
  ],
  "edges": [
    {
      "confidence": "published",
      "from": "target.minecraft.1dffbd6810a2f0f07bcbc666",
      "kind": "targets",
      "sourceEntries": [
        {
          "entryIndex": 565,
          "snapshotId": "mojang.378f919a766c4184b3ce9210",
          "sourceIndexes": [
            0
          ]
        }
      ],
      "to": "component.minecraft.61a6f31a37701a23088dccfc"
    }
  ],
  "id": "catalog.minecraft.d89fc9760faafcb0d28c5424",
  "key": "18w14a",
  "keyKind": "minecraft",
  "platform": "minecraft",
  "schemaVersion": 1,
  "sourceSnapshots": [
    "mojang.378f919a766c4184b3ce9210"
  ]
}
