{
  "$schema": "urn:mcgen:schema:catalog:1",
  "blockers": [],
  "catalogId": "catalog.008de6ad1b5a39d3d1751d8e",
  "category": "toolchain",
  "components": [
    {
      "channel": "release",
      "compatibility": "declared",
      "component": "minecraft-runtime",
      "coordinate": "com.mojang:jre-legacy:java-8",
      "id": "component.java.e3fba5b470c7358dddb8b2cc",
      "sourceEntries": [
        {
          "entryIndex": 830,
          "snapshotId": "java.bcc3a227324932f44e420ef9",
          "sourceIndexes": [
            854
          ]
        }
      ],
      "status": "discovered",
      "version": "8"
    }
  ],
  "edges": [
    {
      "confidence": "published",
      "from": "target.java.081002f2db65ff034de6466b",
      "kind": "targets",
      "sourceEntries": [
        {
          "entryIndex": 830,
          "snapshotId": "java.bcc3a227324932f44e420ef9",
          "sourceIndexes": [
            854
          ]
        }
      ],
      "to": "component.java.e3fba5b470c7358dddb8b2cc"
    }
  ],
  "id": "catalog.java.5411308ed642462f7b6c27d2",
  "key": "a1.0.17_02",
  "keyKind": "minecraft",
  "platform": "java",
  "schemaVersion": 1,
  "sourceSnapshots": [
    "java.bcc3a227324932f44e420ef9"
  ]
}
