{
  "$schema": "urn:mcgen:schema:catalog:1",
  "blockers": [],
  "catalogId": "catalog.9dacda0438726d9cc8ae048a",
  "category": "toolchain",
  "components": [
    {
      "channel": "release",
      "compatibility": "declared",
      "component": "minecraft-runtime",
      "coordinate": "com.mojang:jre-legacy:java-8",
      "id": "component.java.b2f300aaf499ff77b7459c75",
      "sourceEntries": [
        {
          "entryIndex": 847,
          "snapshotId": "java.bcc3a227324932f44e420ef9",
          "sourceIndexes": [
            871
          ]
        }
      ],
      "status": "discovered",
      "version": "8"
    }
  ],
  "edges": [
    {
      "confidence": "published",
      "from": "target.java.af78930bcd8d685d62e33e2d",
      "kind": "targets",
      "sourceEntries": [
        {
          "entryIndex": 847,
          "snapshotId": "java.bcc3a227324932f44e420ef9",
          "sourceIndexes": [
            871
          ]
        }
      ],
      "to": "component.java.b2f300aaf499ff77b7459c75"
    }
  ],
  "id": "catalog.java.50bd0ebb17c49a6aabaaa484",
  "key": "a1.2.3_04",
  "keyKind": "minecraft",
  "platform": "java",
  "schemaVersion": 1,
  "sourceSnapshots": [
    "java.bcc3a227324932f44e420ef9"
  ]
}
