{
  "$schema": "urn:mcgen:schema:catalog:1",
  "blockers": [],
  "catalogId": "catalog.9dacda0438726d9cc8ae048a",
  "category": "toolchain",
  "components": [
    {
      "channel": "snapshot",
      "compatibility": "declared",
      "component": "game-version",
      "coordinate": "com.mojang:minecraft:17w43a",
      "id": "component.minecraft.00c94f704f5db67d98a4fb51",
      "sourceEntries": [
        {
          "entryIndex": 537,
          "snapshotId": "mojang.378f919a766c4184b3ce9210",
          "sourceIndexes": [
            0
          ]
        }
      ],
      "status": "discovered",
      "version": "17w43a"
    }
  ],
  "edges": [
    {
      "confidence": "published",
      "from": "target.minecraft.0bba97a48f7a1a1ad156ca9e",
      "kind": "targets",
      "sourceEntries": [
        {
          "entryIndex": 537,
          "snapshotId": "mojang.378f919a766c4184b3ce9210",
          "sourceIndexes": [
            0
          ]
        }
      ],
      "to": "component.minecraft.00c94f704f5db67d98a4fb51"
    }
  ],
  "id": "catalog.minecraft.414cf747c06749d2ea6a6253",
  "key": "17w43a",
  "keyKind": "minecraft",
  "platform": "minecraft",
  "schemaVersion": 1,
  "sourceSnapshots": [
    "mojang.378f919a766c4184b3ce9210"
  ]
}
