{
  "$schema": "urn:mcgen:schema:catalog:1",
  "blockers": [],
  "catalogId": "catalog.8c773be4f246b07e7bf6fa49",
  "category": "toolchain",
  "components": [
    {
      "channel": "snapshot",
      "component": "game-version",
      "coordinate": "com.mojang:minecraft:17w47a",
      "id": "component.minecraft.6f137db97241359d2d71db4b",
      "sourceEntries": [
        {
          "entryIndex": 542,
          "snapshotId": "mojang.378f919a766c4184b3ce9210",
          "sourceIndexes": [
            0
          ]
        }
      ],
      "status": "discovered",
      "version": "17w47a"
    }
  ],
  "edges": [
    {
      "confidence": "published",
      "from": "target.minecraft.d2fe07e60923faa2fc448bda",
      "kind": "targets",
      "sourceEntries": [
        {
          "entryIndex": 542,
          "snapshotId": "mojang.378f919a766c4184b3ce9210",
          "sourceIndexes": [
            0
          ]
        }
      ],
      "to": "component.minecraft.6f137db97241359d2d71db4b"
    }
  ],
  "id": "catalog.minecraft.81e0627811042107572c4b01",
  "key": "17w47a",
  "keyKind": "minecraft",
  "platform": "minecraft",
  "schemaVersion": 1,
  "sourceSnapshots": [
    "mojang.378f919a766c4184b3ce9210"
  ]
}
