{
  "$schema": "urn:mcgen:schema:catalog:1",
  "blockers": [],
  "catalogId": "catalog.008de6ad1b5a39d3d1751d8e",
  "category": "toolchain",
  "components": [
    {
      "channel": "release",
      "compatibility": "declared",
      "component": "minecraft-runtime",
      "coordinate": "com.mojang:jre-legacy:java-8",
      "id": "component.java.0598b75df46bf02ae2c8a6f2",
      "sourceEntries": [
        {
          "entryIndex": 575,
          "snapshotId": "java.bcc3a227324932f44e420ef9",
          "sourceIndexes": [
            599
          ]
        }
      ],
      "status": "discovered",
      "version": "8"
    }
  ],
  "edges": [
    {
      "confidence": "published",
      "from": "target.java.f2096cff510ed55d9ab9db2f",
      "kind": "targets",
      "sourceEntries": [
        {
          "entryIndex": 575,
          "snapshotId": "java.bcc3a227324932f44e420ef9",
          "sourceIndexes": [
            599
          ]
        }
      ],
      "to": "component.java.0598b75df46bf02ae2c8a6f2"
    }
  ],
  "id": "catalog.java.231cb064adb817e286b08e71",
  "key": "18w48b",
  "keyKind": "minecraft",
  "platform": "java",
  "schemaVersion": 1,
  "sourceSnapshots": [
    "java.bcc3a227324932f44e420ef9"
  ]
}
