{
  "$schema": "urn:mcgen:schema:catalog:1",
  "blockers": [],
  "catalogId": "catalog.9dacda0438726d9cc8ae048a",
  "category": "toolchain",
  "components": [
    {
      "channel": "release",
      "compatibility": "declared",
      "component": "minecraft-runtime",
      "coordinate": "com.mojang:java-runtime-delta:java-21",
      "id": "component.java.127d0bc62df15117d5773527",
      "sourceEntries": [
        {
          "entryIndex": 750,
          "snapshotId": "java.bcc3a227324932f44e420ef9",
          "sourceIndexes": [
            774
          ]
        }
      ],
      "status": "discovered",
      "version": "21"
    }
  ],
  "edges": [
    {
      "confidence": "published",
      "from": "target.java.fa116c7c8c7c6852316b5c3b",
      "kind": "targets",
      "sourceEntries": [
        {
          "entryIndex": 750,
          "snapshotId": "java.bcc3a227324932f44e420ef9",
          "sourceIndexes": [
            774
          ]
        }
      ],
      "to": "component.java.127d0bc62df15117d5773527"
    }
  ],
  "id": "catalog.java.03cd5558bf56e1372acae8bb",
  "key": "25w07a",
  "keyKind": "minecraft",
  "platform": "java",
  "schemaVersion": 1,
  "sourceSnapshots": [
    "java.bcc3a227324932f44e420ef9"
  ]
}
